Cluster,Size,Top Emotions,Avg Review Length,Sample Review
0,3428,"Speedeslimat, good -up, convenience, your quality, Product",72.3757292882147,Fast safe
1,402,"your quality, Product, Priceperformance, Speedeslimat, convenience",75.27611940298507,Quality.
2,2350,"Priceperformance, Speedeslimat, convenience, good -up, your quality",84.60765957446809,Fine f/p
3,158,"hızlıteslimat, ürüngüzel, fiyatperformans, iyipaketleme, uygunfiyat",76.46835443037975,İyi paketleme
4,1304,"good -up, Speedeslimat, Product, convenience, your quality",98.6058282208589,Well -packed
5,4459,"Product, Speedeslimat, Priceperformance, good -up, convenience",76.18165507961426,very nice
6,899,"convenience, Priceperformance, your quality, Speedeslimat, good -up",83.6106785317019,affordable
